{
  "$schema": "https://json-schema.org/draft/2020-12/schema",
  "$id": "https://af-alg-defense/schemas/audit_report.schema.json",
  "title": "AF_ALG Defense Audit Report",
  "description": "Schema for crypto_auditor.py output. Versioned via schema_version; breaking changes bump the major.",
  "type": "object",
  "required": [
    "schema_version",
    "generated_at",
    "host",
    "kernel",
    "crypto_algorithms",
    "crypto_modules",
    "sysctls",
    "findings",
    "summary"
  ],
  "additionalProperties": false,
  "properties": {
    "schema_version": {
      "type": "string",
      "pattern": "^[0-9]+\\.[0-9]+\\.[0-9]+$"
    },
    "generated_at": {
      "type": "string",
      "format": "date-time"
    },
    "host": {
      "type": "object",
      "required": ["hostname", "os"],
      "properties": {
        "hostname": { "type": "string" },
        "os":       { "type": "string" }
      },
      "additionalProperties": true
    },
    "kernel": {
      "type": "object",
      "required": ["release", "version", "machine", "fips_enabled"],
      "properties": {
        "release":      { "type": "string" },
        "version":      { "type": "string" },
        "machine":      { "type": "string" },
        "lockdown":     { "type": ["string", "null"] },
        "fips_enabled": { "type": "boolean" }
      },
      "additionalProperties": true
    },
    "crypto_algorithms": {
      "type": "array",
      "items": {
        "type": "object",
        "required": [
          "name", "driver", "module", "type",
          "priority", "internal", "fips_flagged", "selftest_passed"
        ],
        "properties": {
          "name":             { "type": "string" },
          "driver":           { "type": "string" },
          "module":           { "type": "string" },
          "type":             { "type": "string" },
          "priority":         { "type": "integer" },
          "internal":         { "type": "boolean" },
          "fips_flagged":     { "type": "boolean" },
          "selftest_passed":  { "type": "boolean" },
          "raw":              { "type": "object" }
        },
        "additionalProperties": false
      }
    },
    "crypto_modules": {
      "type": "array",
      "items": {
        "type": "object",
        "required": ["name"],
        "properties": {
          "name":       { "type": "string" },
          "refcount":   { "type": ["integer", "null"] },
          "taint":      { "type": ["string", "null"] },
          "parameters": {
            "type": "object",
            "additionalProperties": { "type": "string" }
          }
        },
        "additionalProperties": false
      }
    },
    "sysctls": {
      "type": "array",
      "items": {
        "type": "object",
        "required": ["path", "expected", "actual", "hardened"],
        "properties": {
          "path":     { "type": "string" },
          "expected": { "type": "string" },
          "actual":   { "type": ["string", "null"] },
          "hardened": { "type": "boolean" }
        },
        "additionalProperties": false
      }
    },
    "findings": {
      "type": "array",
      "items": {
        "type": "object",
        "required": ["id", "severity", "title", "details", "remediation"],
        "properties": {
          "id": {
            "type": "string",
            "pattern": "^FND-[0-9]{3}$"
          },
          "severity": {
            "type": "string",
            "enum": ["info", "low", "medium", "high", "critical"]
          },
          "title":       { "type": "string" },
          "details":     { "type": "string" },
          "remediation": { "type": "string" }
        },
        "additionalProperties": false
      }
    },
    "summary": {
      "type": "object",
      "required": [
        "algorithms_total", "algorithms_fips",
        "modules_total",
        "sysctls_hardened", "sysctls_total",
        "findings_total", "findings_high", "findings_medium"
      ],
      "properties": {
        "algorithms_total": { "type": "integer", "minimum": 0 },
        "algorithms_fips":  { "type": "integer", "minimum": 0 },
        "modules_total":    { "type": "integer", "minimum": 0 },
        "sysctls_hardened": { "type": "integer", "minimum": 0 },
        "sysctls_total":    { "type": "integer", "minimum": 0 },
        "findings_total":   { "type": "integer", "minimum": 0 },
        "findings_high":    { "type": "integer", "minimum": 0 },
        "findings_medium":  { "type": "integer", "minimum": 0 }
      },
      "additionalProperties": false
    }
  }
}
