{
  "crypto_algorithms": [
    {
      "driver": "cbc(ecb(aes-fixed-time))",
      "fips_flagged": false,
      "internal": false,
      "module": "kernel",
      "name": "cbc(aes)",
      "priority": 101,
      "raw": {
        "blocksize": "16",
        "chunksize": "16",
        "driver": "cbc(ecb(aes-fixed-time))",
        "internal": "no",
        "ivsize": "16",
        "max keysize": "32",
        "min keysize": "16",
        "module": "kernel",
        "name": "cbc(aes)",
        "priority": "101",
        "refcnt": "1",
        "selftest": "passed",
        "statesize": "0",
        "type": "lskcipher"
      },
      "selftest_passed": true,
      "type": "lskcipher"
    },
    {
      "driver": "ecb(aes-fixed-time)",
      "fips_flagged": false,
      "internal": false,
      "module": "kernel",
      "name": "ecb(aes)",
      "priority": 101,
      "raw": {
        "blocksize": "16",
        "chunksize": "16",
        "driver": "ecb(aes-fixed-time)",
        "internal": "no",
        "ivsize": "0",
        "max keysize": "32",
        "min keysize": "16",
        "module": "kernel",
        "name": "ecb(aes)",
        "priority": "101",
        "refcnt": "1",
        "selftest": "passed",
        "statesize": "0",
        "type": "lskcipher"
      },
      "selftest_passed": true,
      "type": "lskcipher"
    },
    {
      "driver": "ecdh-nist-p384-generic",
      "fips_flagged": false,
      "internal": false,
      "module": "kernel",
      "name": "ecdh-nist-p384",
      "priority": 100,
      "raw": {
        "driver": "ecdh-nist-p384-generic",
        "internal": "no",
        "module": "kernel",
        "name": "ecdh-nist-p384",
        "priority": "100",
        "refcnt": "1",
        "selftest": "passed",
        "type": "kpp"
      },
      "selftest_passed": true,
      "type": "kpp"
    }
  ],
  "crypto_modules": [],
  "findings": [
    {
      "details": "expected='0', actual=None",
      "id": "FND-002",
      "remediation": "Apply the af_alg_hardening Ansible role.",
      "severity": "high",
      "title": "Sysctl /proc/sys/kernel/unprivileged_userns_clone not at hardened value"
    },
    {
      "details": "expected='0', actual='15984'",
      "id": "FND-002",
      "remediation": "Apply the af_alg_hardening Ansible role.",
      "severity": "high",
      "title": "Sysctl /proc/sys/user/max_user_namespaces not at hardened value"
    },
    {
      "details": "expected='2', actual='0'",
      "id": "FND-002",
      "remediation": "Apply the af_alg_hardening Ansible role.",
      "severity": "high",
      "title": "Sysctl /proc/sys/kernel/kptr_restrict not at hardened value"
    },
    {
      "details": "expected='1', actual='0'",
      "id": "FND-002",
      "remediation": "Apply the af_alg_hardening Ansible role.",
      "severity": "high",
      "title": "Sysctl /proc/sys/kernel/dmesg_restrict not at hardened value"
    },
    {
      "details": "expected='1', actual='2'",
      "id": "FND-002",
      "remediation": "Apply the af_alg_hardening Ansible role.",
      "severity": "high",
      "title": "Sysctl /proc/sys/kernel/unprivileged_bpf_disabled not at hardened value"
    },
    {
      "details": "Lockdown mode 'none' permits modifications to running kernel state that can be used to bypass AF_ALG controls.",
      "id": "FND-003",
      "remediation": "Boot with lockdown=integrity or enable via MOK/secure boot.",
      "severity": "medium",
      "title": "Kernel lockdown is not enabled"
    }
  ],
  "generated_at": "2026-05-02T09:48:34.580482+00:00",
  "host": {
    "hostname": "vm",
    "os": "Linux-6.18.5-x86_64-with-glibc2.39"
  },
  "kernel": {
    "fips_enabled": false,
    "lockdown": null,
    "machine": "x86_64",
    "release": "6.18.5",
    "version": "#2 SMP PREEMPT_DYNAMIC Wed Jan 14 17:56:08 UTC 2026"
  },
  "schema_version": "1.0.0",
  "summary": {
    "algorithms_fips": 0,
    "algorithms_total": 52,
    "findings_high": 5,
    "findings_medium": 1,
    "findings_total": 6,
    "modules_total": 0,
    "sysctls_hardened": 0,
    "sysctls_total": 5
  },
  "sysctls": [
    {
      "actual": null,
      "expected": "0",
      "hardened": false,
      "path": "/proc/sys/kernel/unprivileged_userns_clone"
    },
    {
      "actual": "15984",
      "expected": "0",
      "hardened": false,
      "path": "/proc/sys/user/max_user_namespaces"
    },
    {
      "actual": "0",
      "expected": "2",
      "hardened": false,
      "path": "/proc/sys/kernel/kptr_restrict"
    },
    {
      "actual": "0",
      "expected": "1",
      "hardened": false,
      "path": "/proc/sys/kernel/dmesg_restrict"
    },
    {
      "actual": "2",
      "expected": "1",
      "hardened": false,
      "path": "/proc/sys/kernel/unprivileged_bpf_disabled"
    }
  ]
}